{
  "schema_version": "1.5",
  "codemeta_tag": "3.1",
  "generator": {
    "name": "codemeta-drift",
    "version": "0.5.0"
  },
  "rows": [
    {
      "format": "cff-1.2.0",
      "term": "name",
      "path": "title",
      "source": "crosswalk:crosswalks/Citation File Format 1.2.0.csv@3.1",
      "crosswalk_cell": "title"
    },
    {
      "format": "cff-1.2.0",
      "term": "version",
      "path": "version",
      "source": "crosswalk:crosswalks/Citation File Format 1.2.0.csv@3.1",
      "crosswalk_cell": "version"
    },
    {
      "format": "cff-1.2.0",
      "term": "author",
      "path": "authors[]",
      "source": "crosswalk:crosswalks/Citation File Format 1.2.0.csv@3.1",
      "crosswalk_cell": "authors"
    },
    {
      "format": "cff-1.2.0",
      "term": "author.givenName",
      "path": "authors[].given-names",
      "source": "crosswalk:crosswalks/Citation File Format 1.2.0.csv@3.1",
      "crosswalk_cell": "person.given-names"
    },
    {
      "format": "cff-1.2.0",
      "term": "author.familyName",
      "path": "authors[].family-names",
      "source": "crosswalk:crosswalks/Citation File Format 1.2.0.csv@3.1",
      "comment": "CFF keeps a name particle and suffix apart: the family name is name-particle, family-names and name-suffix joined by spaces, so Antonie van Leeuwenhoek has family-names Leeuwenhoek and name-particle van, and a family name of van Leeuwenhoek.",
      "crosswalk_cell": "person.family-names"
    },
    {
      "format": "cff-1.2.0",
      "term": "author.@id",
      "path": "authors[].orcid",
      "source": "curated:the cell lists person.orcid / identifiers / doi; a person's ORCID is orcid",
      "crosswalk_cell": "person.orcid / identifiers / doi"
    },
    {
      "format": "cff-1.2.0",
      "term": "contributor",
      "path": null,
      "source": "curated:no cell for contributors; CFF 1.2.0 has no contributor list, only authors",
      "crosswalk_cell": ""
    },
    {
      "format": "cff-1.2.0",
      "term": "contributor.givenName",
      "path": null,
      "source": "curated:no cell for contributors; CFF 1.2.0 has no contributor list, only authors",
      "crosswalk_cell": "person.given-names"
    },
    {
      "format": "cff-1.2.0",
      "term": "contributor.familyName",
      "path": null,
      "source": "curated:no cell for contributors; CFF 1.2.0 has no contributor list, only authors",
      "crosswalk_cell": "person.family-names"
    },
    {
      "format": "cff-1.2.0",
      "term": "contributor.@id",
      "path": null,
      "source": "curated:no cell for contributors; CFF 1.2.0 has no contributor list, only authors",
      "crosswalk_cell": "person.orcid / identifiers / doi"
    },
    {
      "format": "cff-1.2.0",
      "term": "license",
      "path": "license",
      "source": "curated:the cell lists license / license-url; license-url holds a licence URL, not an SPDX id",
      "crosswalk_cell": "license / license-url"
    },
    {
      "format": "cff-1.2.0",
      "term": "identifier",
      "path": "doi | identifiers[type=doi].value",
      "source": "curated:the cell lists identifiers / person.orcid / doi; the software DOI is doi, or the doi entry of identifiers",
      "crosswalk_cell": "identifiers / person.orcid / doi"
    },
    {
      "format": "cff-1.2.0",
      "term": "swhid",
      "path": "identifiers[type=swh].value",
      "source": "curated:the cell lists identifiers / person.orcid / doi; a SWHID is the swh entry of identifiers",
      "crosswalk_cell": "identifiers / person.orcid / doi"
    },
    {
      "format": "cff-1.2.0",
      "term": "codeRepository",
      "path": "repository-code",
      "source": "crosswalk:crosswalks/Citation File Format 1.2.0.csv@3.1",
      "crosswalk_cell": "repository-code"
    },
    {
      "format": "cff-1.2.0",
      "term": "description",
      "path": "abstract",
      "source": "crosswalk:crosswalks/Citation File Format 1.2.0.csv@3.1",
      "crosswalk_cell": "abstract"
    },
    {
      "format": "cff-1.2.0",
      "term": "keywords",
      "path": "keywords",
      "source": "crosswalk:crosswalks/Citation File Format 1.2.0.csv@3.1",
      "crosswalk_cell": "keywords"
    },
    {
      "format": "cff-1.2.0",
      "term": "datePublished",
      "path": "date-released",
      "source": "crosswalk:crosswalks/Citation File Format 1.2.0.csv@3.1",
      "crosswalk_cell": "date-released"
    },
    {
      "format": "codemeta",
      "term": "name",
      "path": "name",
      "source": "curated:codemeta's own term",
      "crosswalk_cell": null
    },
    {
      "format": "codemeta",
      "term": "version",
      "path": "version",
      "source": "curated:codemeta's own term",
      "crosswalk_cell": null
    },
    {
      "format": "codemeta",
      "term": "author",
      "path": "author[]",
      "source": "curated:codemeta's own term",
      "crosswalk_cell": null
    },
    {
      "format": "codemeta",
      "term": "author.givenName",
      "path": "author[].givenName",
      "source": "curated:codemeta's own term",
      "crosswalk_cell": null
    },
    {
      "format": "codemeta",
      "term": "author.familyName",
      "path": "author[].familyName",
      "source": "curated:codemeta's own term",
      "crosswalk_cell": null
    },
    {
      "format": "codemeta",
      "term": "author.@id",
      "path": "author[].@id",
      "source": "curated:codemeta's own term",
      "crosswalk_cell": null
    },
    {
      "format": "codemeta",
      "term": "contributor",
      "path": "contributor[]",
      "source": "curated:codemeta's own term",
      "crosswalk_cell": null
    },
    {
      "format": "codemeta",
      "term": "contributor.givenName",
      "path": "contributor[].givenName",
      "source": "curated:codemeta's own term",
      "crosswalk_cell": null
    },
    {
      "format": "codemeta",
      "term": "contributor.familyName",
      "path": "contributor[].familyName",
      "source": "curated:codemeta's own term",
      "crosswalk_cell": null
    },
    {
      "format": "codemeta",
      "term": "contributor.@id",
      "path": "contributor[].@id",
      "source": "curated:codemeta's own term",
      "crosswalk_cell": null
    },
    {
      "format": "codemeta",
      "term": "license",
      "path": "license",
      "source": "curated:codemeta's own term",
      "crosswalk_cell": null
    },
    {
      "format": "codemeta",
      "term": "identifier",
      "path": "identifier",
      "source": "curated:codemeta's own term",
      "crosswalk_cell": null
    },
    {
      "format": "codemeta",
      "term": "swhid",
      "path": "identifier",
      "source": "curated:CodeMeta has no SWHID term; a SWHID sits in identifier, beside the DOI, as a swh:1: string or a PropertyValue (propertyID SWHID) whose value is one",
      "crosswalk_cell": null
    },
    {
      "format": "codemeta",
      "term": "codeRepository",
      "path": "codeRepository",
      "source": "curated:codemeta's own term",
      "crosswalk_cell": null
    },
    {
      "format": "codemeta",
      "term": "description",
      "path": "description",
      "source": "curated:codemeta's own term",
      "crosswalk_cell": null
    },
    {
      "format": "codemeta",
      "term": "keywords",
      "path": "keywords",
      "source": "curated:codemeta's own term",
      "crosswalk_cell": null
    },
    {
      "format": "codemeta",
      "term": "datePublished",
      "path": "datePublished",
      "source": "curated:codemeta's own term",
      "crosswalk_cell": null
    },
    {
      "format": "zenodo",
      "term": "name",
      "path": "title",
      "source": "crosswalk:crosswalks/Zenodo.csv@3.1",
      "crosswalk_cell": "title"
    },
    {
      "format": "zenodo",
      "term": "version",
      "path": "version",
      "source": "crosswalk:crosswalks/Zenodo.csv@3.1",
      "crosswalk_cell": "version"
    },
    {
      "format": "zenodo",
      "term": "author",
      "path": "creators[]",
      "source": "crosswalk:crosswalks/Zenodo.csv@3.1",
      "crosswalk_cell": "creators"
    },
    {
      "format": "zenodo",
      "term": "author.givenName",
      "path": "creators[].name",
      "source": "curated:no cell; Zenodo keeps one name string per creator, written 'Family, Given'",
      "crosswalk_cell": ""
    },
    {
      "format": "zenodo",
      "term": "author.familyName",
      "path": "creators[].name",
      "source": "curated:no cell; Zenodo keeps one name string per creator, written 'Family, Given'",
      "crosswalk_cell": ""
    },
    {
      "format": "zenodo",
      "term": "author.@id",
      "path": "creators[].orcid",
      "source": "curated:the cell says ORCID; the .zenodo.json key is orcid",
      "crosswalk_cell": "ORCID"
    },
    {
      "format": "zenodo",
      "term": "contributor",
      "path": "contributors[]",
      "source": "curated:no cell; .zenodo.json lists contributors under contributors, each with a name, a type and an optional orcid",
      "crosswalk_cell": ""
    },
    {
      "format": "zenodo",
      "term": "contributor.givenName",
      "path": "contributors[].name",
      "source": "curated:no cell; Zenodo keeps one name string per contributor, written 'Family, Given'",
      "crosswalk_cell": ""
    },
    {
      "format": "zenodo",
      "term": "contributor.familyName",
      "path": "contributors[].name",
      "source": "curated:no cell; Zenodo keeps one name string per contributor, written 'Family, Given'",
      "crosswalk_cell": ""
    },
    {
      "format": "zenodo",
      "term": "contributor.@id",
      "path": "contributors[].orcid",
      "source": "curated:the cell says ORCID; the .zenodo.json key is orcid",
      "crosswalk_cell": "ORCID"
    },
    {
      "format": "zenodo",
      "term": "license",
      "path": "license",
      "source": "crosswalk:crosswalks/Zenodo.csv@3.1",
      "crosswalk_cell": "license"
    },
    {
      "format": "zenodo",
      "term": "identifier",